{
  "$schema": "https://json-schema.org/draft/2020-12/schema",
  "$id": "https://bim-database.local/schema/house.schema.json",
  "title": "House",
  "description": "One house record (catalog product or building documentation). Enum values must come from data/ontology.json.",
  "type": "object",
  "required": ["id", "model", "source"],
  "additionalProperties": false,
  "properties": {
    "id":            {"type": "integer", "minimum": 1, "description": "Globally unique numeric id. The on-disk key is `house-<id>`."},
    "model":         {"type": "string", "description": "Human-readable name. For catalog records, the model/variant name; for documentation records, the building's address or descriptor."},
    "manufacturer":  {"type": ["string", "null"], "description": "Catalog only: producer name (e.g. 'Hanse Haus')."},
    "source":        {"type": "string", "description": "Where the record came from. Enum: see ontology.sources."},
    "source_url":    {"type": ["string", "null"], "format": "uri"},
    "source_origin": {"type": ["string", "null"], "description": "Free-form note on the source documents (e.g. 'scanned 1956 Baubeschreibung + Ansichten')."},

    "building_type":   {"type": ["string", "null"], "description": "Enum: see ontology.building_types."},
    "construction":    {"type": ["string", "null"], "description": "Enum: see ontology.constructions."},
    "roof_type":       {"type": ["string", "null"], "description": "Enum: see ontology.roof_types."},
    "style":           {"type": ["string", "null"], "description": "Enum: see ontology.styles."},
    "energy_standard": {"type": ["string", "null"], "description": "Enum: see ontology.energy_standards."},

    "year_built":    {"type": ["integer", "null"], "description": "Year of original construction (existing buildings) or product introduction (catalog)."},
    "has_basement":  {"type": ["boolean", "null"], "description": "Keller vorhanden."},
    "levels":        {"type": ["array", "null"], "items": {"type": "string"}, "description": "Stack of inhabited levels, top-to-bottom in build order, e.g. ['KG','EG','OG','DG']. Enum values: see ontology.levels."},

    "area_m2":          {"type": ["number", "null"], "description": "Wohnfläche in m²."},
    "rooms":            {"type": ["integer", "null"], "description": "Zimmeranzahl."},
    "floors":           {"type": ["number", "null"], "description": "Geschosse (z.B. 1.5 für EG+ausgebautes DG)."},
    "price_eur":        {"type": ["number", "null"]},
    "price_on_request": {"type": ["boolean", "null"]},

    "site":          {"type": ["string", "null"], "description": "Grundstück / Lage (z.B. 'Hanglage', 'urbane Baulücke')."},
    "character":     {"type": ["string", "null"], "description": "Kurzbeschreibung der architektonischen Besonderheiten."},
    "agent_notes":   {"type": ["string", "null"], "description": "Hinweise für AI-Agenten, die das Haus modellieren."},
    "tags":          {"type": "array", "items": {"type": "string"}, "description": "Freiform-Tags."},

    "images":        {"type": "array", "items": {"$ref": "#/$defs/Image"}, "description": "Per-image metadata. Empty array if no images yet."},
    "source_pdfs":   {"type": "array", "items": {"type": "string"}, "description": "List of source-PDF filenames in the house folder (auto-discovered if omitted)."},

    "derived_facts": {
      "type":  ["object", "null"],
      "description": "House-level numeric facts derived + cross-checked from per-scene facts. Each entry is {value, sources: [scene-file], expected?, ok?}. Produced by the house-data-standardization skill.",
      "additionalProperties": {
        "type": "object",
        "required": ["value"],
        "properties": {
          "value":    {"description": "Number, array, or string."},
          "sources":  {"type": "array", "items": {"type": "string"}, "description": "Image filenames (scenes) the value was derived from."},
          "expected": {"description": "Optional expected value / range for cross-check."},
          "ok":       {"type": "boolean", "description": "Did the derived value match the expected?"}
        }
      }
    },
    "anomaly_flags": {
      "type": ["array", "null"],
      "items": {"type": "string"},
      "description": "House-level data inconsistencies surfaced during standardization (e.g. 'scene-date 1939 contradicts character text saying 1956'). Human review required."
    },

    "bim_ai_blocking_issues": {
      "type": ["array", "null"],
      "items": {"type": "string", "pattern": "^[^/]+/[^#]+#[0-9]+$"},
      "description": "Tri-state: field missing OR null → not yet assessed (UI shows no badge). Empty list → assessed, no blockers (✓ modellierbar). Non-empty list → blocked by these issues until they close. Format: 'owner/repo#NNN'. Cache in data/.issue_state.json, refresh via `make refresh-issue-state`."
    },

    "data_quality": {
      "type": ["object", "null"],
      "additionalProperties": false,
      "description": "How reconstructable the house is from THIS entry alone. The API derives a single `reconstructability_tier` from these fields (rolled up, not stored on disk). Most axes can be auto-populated by scripts/derive_data_quality.py from the images array; upgrading past 'dimensioned' / 'summary' requires reading the source.",
      "properties": {
        "floorplan_grade":    {"type": ["string", "null"], "description": "Enum: ontology.floorplan_grades"},
        "exterior_coverage":  {"type": ["string", "null"], "description": "Enum: ontology.exterior_coverages"},
        "elevation_set":      {"type": ["string", "null"], "description": "Enum: ontology.elevation_sets"},
        "section_drawing":    {"type": ["string", "null"], "description": "Enum: ontology.section_drawings"},
        "roof_plan":          {"type": ["string", "null"], "description": "Enum: ontology.presence_flags"},
        "site_plan":          {"type": ["string", "null"], "description": "Enum: ontology.presence_flags"},
        "construction_specs": {"type": ["string", "null"], "description": "Enum: ontology.construction_specs_grades"}
      }
    }
  },
  "$defs": {
    "Image": {
      "type": "object",
      "required": ["file", "category", "medium"],
      "additionalProperties": false,
      "properties": {
        "file":     {"type": "string", "description": "Filename relative to the house folder (e.g. 'hanse_variant35172_exterior10.original.avif')."},
        "category": {"type": "string", "description": "Enum: see ontology.image_categories."},
        "medium":   {"type": "string", "description": "Enum: see ontology.image_mediums."},
        "view":     {"type": ["string", "null"], "description": "Enum: see ontology.image_views. Only meaningful for exteriors/elevations."},
        "floor":    {"type": ["string", "null"], "description": "Enum: see ontology.levels. Only meaningful for floorplans."},
        "caption":  {"type": ["string", "null"], "description": "Kurzbeschreibung."},

        "source_ref": {
          "type": ["object", "null"],
          "additionalProperties": false,
          "description": "Provenance: which source artifact this scene was cropped/rendered from. Empty for original (non-derived) images. Populated by the house-data-standardization skill.",
          "properties": {
            "file":          {"type": "string", "description": "Source filename relative to the house folder (e.g. 'Ansichten.pdf' or 'mhstyle_floorplan1.original.avif')."},
            "page":          {"type": ["integer", "null"], "description": "PDF page number (1-indexed). Null for non-PDF sources."},
            "crop_box_pct":  {"type": ["array", "null"], "items": {"type": "number"}, "minItems": 4, "maxItems": 4, "description": "[x0, y0, x1, y1] as fractions of the source-page dimensions (DPI-independent)."},
            "dpi":           {"type": ["integer", "null"], "description": "Render DPI for the source PDF page when reconstructing the scene image. Optional; the renderer defaults to 200 if omitted."},
            "rotation_deg":  {"type": ["integer", "null"], "description": "Rotate the rendered page by this many degrees counter-clockwise BEFORE applying crop_box_pct. Use for PDFs whose content is drawn rotated relative to the page orientation (e.g. landscape architectural plans on a portrait sheet). Optional; renderer defaults to 0."},
            "page_title":    {"type": ["string", "null"], "description": "Title block / page header text observed on the source page."},
            "scale":         {"type": ["string", "null"], "description": "Drawing scale label, e.g. '1:100'."}
          }
        },
        "facts": {
          "type": ["object", "null"],
          "description": "Scene-level numeric/categorical facts extracted by AI vision. Each entry is {value, evidence?}; value can be number, string, array, or object.",
          "additionalProperties": {
            "type": "object",
            "required": ["value"],
            "properties": {
              "value":    {"description": "The extracted fact."},
              "evidence": {"type": ["string", "null"], "description": "What in the scene supports this (label text, count rationale, etc.)."},
              "unit":     {"type": ["string", "null"], "description": "Unit if numeric (mm, m², °, count)."}
            }
          }
        },
        "anomaly_flags": {
          "type": ["array", "null"],
          "items": {"type": "string"},
          "description": "Scene-level anomalies — e.g. 'scale label illegible', 'dimension annotation appears to contradict adjacent label'."
        }
      }
    }
  }
}
