{
  "id": 40,
  "model": "Solitaire E165 Entwurf 3",
  "manufacturer": "Schwabenhaus",
  "source": "catalog",
  "source_url": "https://www.fertighaus.de/haeuser/solitaire-e-165-entwurf-3/",
  "source_origin": null,
  "building_type": "EFH",
  "construction": "Fertighaus",
  "roof_type": "Satteldach",
  "style": "modern",
  "energy_standard": null,
  "year_built": null,
  "has_basement": null,
  "levels": [
    "EG",
    "DG"
  ],
  "area_m2": 165,
  "rooms": null,
  "floors": null,
  "price_eur": null,
  "price_on_request": true,
  "site": null,
  "character": "Modernes EFH mit asymmetrischem Satteldach, anschließendem Flachdach-Anbau mit Auskragung, Balkon und großen Fenstern.",
  "agent_notes": "asymmetric_gable + Flachdach-Seitenvolumen. Giebelfenster blockiert #109.",
  "tags": [
    "asymmetric-gable",
    "flachdach-anbau",
    "balkon",
    "auskragung"
  ],
  "images": [
    {
      "file": "schwabenhaus_solitaeree165-e3_exterior1.original.avif",
      "category": "exterior",
      "medium": "render",
      "view": null,
      "caption": null
    },
    {
      "file": "schwabenhaus_solitaeree165-e3_floorplan1.original.avif",
      "category": "floorplan",
      "medium": "drawing",
      "floor": null,
      "caption": null
    },
    {
      "file": "schwabenhaus_solitaeree165-e3_floorplan2.original.avif",
      "category": "floorplan",
      "medium": "drawing",
      "floor": null,
      "caption": null
    }
  ],
  "bim_ai_blocking_issues": [
    "jhoetter/bim-ai#109"
  ]
}
