{
  "id": 48,
  "model": "Selection E175 Entwurf 5",
  "manufacturer": "Schwabenhaus",
  "source": "catalog",
  "source_url": "https://www.fertighaus.de/haeuser/selection-e-175-entwurf-5/",
  "source_origin": null,
  "building_type": "EFH",
  "construction": "Fertighaus",
  "roof_type": "Flachdach",
  "style": "bauhaus",
  "energy_standard": null,
  "year_built": null,
  "has_basement": null,
  "levels": [
    "EG",
    "1. OG"
  ],
  "area_m2": 175,
  "rooms": null,
  "floors": null,
  "price_eur": null,
  "price_on_request": true,
  "site": null,
  "character": "Kubisches Bauhaus-EFH mit Flachdach, klaren Kanten, schmalen OG-Oberlichtbändern und holzverkleidetem Eingangsbereich.",
  "agent_notes": "Reiner Flachdach-Kubus, Holzakzent am Eingang. Voll modellierbar.",
  "tags": [
    "bauhaus",
    "flachdach",
    "kubisch"
  ],
  "images": [
    {
      "file": "schwabenhaus_sel175e5_exterior1.original.avif",
      "category": "exterior",
      "medium": "render",
      "view": null,
      "caption": null
    },
    {
      "file": "schwabenhaus_sel175e5_exterior2.original.avif",
      "category": "exterior",
      "medium": "render",
      "view": null,
      "caption": null
    },
    {
      "file": "schwabenhaus_sel175e5_floorplan1.original.avif",
      "category": "floorplan",
      "medium": "drawing",
      "floor": null,
      "caption": null
    },
    {
      "file": "schwabenhaus_sel175e5_floorplan2.original.avif",
      "category": "floorplan",
      "medium": "drawing",
      "floor": null,
      "caption": null
    }
  ],
  "bim_ai_blocking_issues": []
}
