{
  "id": 72,
  "model": "EFH 2",
  "manufacturer": "Saale-Haus",
  "source": "catalog",
  "source_url": "https://www.fertighaus.de/haeuser/saale-haus-efh2/",
  "source_origin": null,
  "building_type": "EFH",
  "construction": null,
  "roof_type": null,
  "style": null,
  "energy_standard": null,
  "year_built": null,
  "has_basement": null,
  "levels": null,
  "area_m2": null,
  "rooms": null,
  "floors": null,
  "price_eur": null,
  "price_on_request": true,
  "site": null,
  "character": null,
  "agent_notes": null,
  "tags": [],
  "images": [
    {
      "file": "saale-haus_efh2_exterior1.original.avif",
      "category": "exterior",
      "medium": "render",
      "view": null,
      "caption": null
    },
    {
      "file": "saale-haus_efh2_floorplan1.original.avif",
      "category": "floorplan",
      "medium": "drawing",
      "floor": null,
      "caption": null
    },
    {
      "file": "saale-haus_efh2_floorplan2.original.avif",
      "category": "floorplan",
      "medium": "drawing",
      "floor": null,
      "caption": null
    }
  ]
}
