{
  "id": 2,
  "model": "EFH Klassik 118",
  "manufacturer": "hebelHAUS",
  "source": "catalog",
  "source_url": "https://www.fertighaus.de/haeuser/hebel-efh-klassik118/",
  "source_origin": null,
  "building_type": "EFH",
  "construction": "Massivhaus",
  "roof_type": "Satteldach",
  "style": "klassisch",
  "energy_standard": "Effizienzhaus 55",
  "year_built": null,
  "has_basement": null,
  "levels": [
    "EG",
    "DG"
  ],
  "area_m2": 118,
  "rooms": 5,
  "floors": 1.5,
  "price_eur": null,
  "price_on_request": true,
  "site": null,
  "character": "Klassisches kompaktes EFH mit Satteldach. Rückseitige Schleppgaube über voll verglaster 2-geschossiger Eingangs-/Wohnachse — die Gaube ist samt Wangen verglast (Glasgaube). Sonst rechteckiger, schlichter Baukörper.",
  "agent_notes": "Satteldach + Schleppgaube (DormerRoofKind=flat) + große Glasfront — alles bim-ai-Standard. Glas-Wangen der Gaube sind kosmetisch (Material), kein eigenes Element.",
  "tags": [],
  "bim_ai_blocking_issues": [],
  "images": [
    {
      "file": "hebel_efh-klassik118_exterior1.original.avif",
      "category": "exterior",
      "medium": "render",
      "view": "rear",
      "caption": "Gartenseite — Satteldach mit voll verglaster Schleppgaube über 2-stöckigem Wohnzimmerfenster"
    },
    {
      "file": "hebel_efh-klassik118_exterior2.original.avif",
      "category": "exterior",
      "medium": "render",
      "view": "corner",
      "caption": "Eckansicht"
    },
    {
      "file": "hebel_efh-klassik118_floorplan1.original.avif",
      "category": "floorplan",
      "medium": "drawing",
      "floor": "EG",
      "caption": "Grundriss EG"
    },
    {
      "file": "hebel_efh-klassik118_floorplan2.original.avif",
      "category": "floorplan",
      "medium": "drawing",
      "floor": "DG",
      "caption": "Grundriss DG"
    }
  ],
  "data_quality": {
    "floorplan_grade": "dimensioned",
    "exterior_coverage": "multi_view",
    "elevation_set": "none",
    "section_drawing": "none",
    "roof_plan": "absent",
    "site_plan": "absent",
    "construction_specs": "summary"
  }
}
