{
  "id": 69,
  "model": "MFH",
  "manufacturer": "Saale-Haus",
  "source": "catalog",
  "source_url": "https://www.fertighaus.de/haeuser/saale-haus-mfh/",
  "source_origin": null,
  "building_type": "MFH",
  "construction": null,
  "roof_type": "Mansarddach",
  "style": "stadtvilla",
  "energy_standard": null,
  "year_built": null,
  "has_basement": null,
  "levels": [
    "EG",
    "1. OG",
    "DG"
  ],
  "area_m2": null,
  "rooms": null,
  "floors": null,
  "price_eur": null,
  "price_on_request": true,
  "site": null,
  "character": "Dreigeschossiges MFH im Stadtvilla-Stil mit Mansarddach, mehreren Mansardgauben, durchgehender Balkonzone und Putzfassade.",
  "agent_notes": "Mansarddach + Mansardgauben blockiert (#112).",
  "tags": [
    "mfh",
    "stadtvilla",
    "mansarddach",
    "mansardgaube"
  ],
  "images": [
    {
      "file": "saale-haus_mfh_exterior1.original.avif",
      "category": "exterior",
      "medium": "render",
      "view": null,
      "caption": null
    },
    {
      "file": "saale-haus_mfh_floorplan1.original.avif",
      "category": "floorplan",
      "medium": "drawing",
      "floor": null,
      "caption": null
    },
    {
      "file": "saale-haus_mfh_floorplan2.original.avif",
      "category": "floorplan",
      "medium": "drawing",
      "floor": null,
      "caption": null
    },
    {
      "file": "saale-haus_mfh_floorplan3.original.avif",
      "category": "floorplan",
      "medium": "drawing",
      "floor": null,
      "caption": null
    }
  ],
  "bim_ai_blocking_issues": [
    "jhoetter/bim-ai#112"
  ]
}
