{
  "id": 43,
  "model": "SmartSpace E120 Entwurf 1",
  "manufacturer": "Schwabenhaus",
  "source": "catalog",
  "source_url": "https://www.fertighaus.de/haeuser/schwabenhaus-smartspace-e120e1/",
  "source_origin": null,
  "building_type": "EFH",
  "construction": "Fertighaus",
  "roof_type": null,
  "style": "modern",
  "energy_standard": null,
  "year_built": null,
  "has_basement": null,
  "levels": null,
  "area_m2": 120,
  "rooms": null,
  "floors": null,
  "price_eur": null,
  "price_on_request": true,
  "site": null,
  "character": null,
  "agent_notes": null,
  "tags": [],
  "images": [
    {
      "file": "schwabenhaus_smartspace120-e1_exterior1.original.avif",
      "category": "exterior",
      "medium": "render",
      "view": null,
      "caption": null
    },
    {
      "file": "schwabenhaus_smartspace120-e1_floorplan1.original.avif",
      "category": "floorplan",
      "medium": "drawing",
      "floor": null,
      "caption": null
    },
    {
      "file": "schwabenhaus_smartspace120-e1_floorplan2.original.avif",
      "category": "floorplan",
      "medium": "drawing",
      "floor": null,
      "caption": null
    }
  ]
}
