{
  "id": 24,
  "model": "Friesenhaus FS168",
  "manufacturer": "Nurda",
  "source": "catalog",
  "source_url": "https://www.fertighaus.de/haeuser/nurda-friesenhausfs168/",
  "source_origin": null,
  "building_type": "EFH",
  "construction": "Fertighaus",
  "roof_type": "Satteldach",
  "style": "landhaus",
  "energy_standard": null,
  "year_built": null,
  "has_basement": null,
  "levels": [
    "EG",
    "DG"
  ],
  "area_m2": 168,
  "rooms": null,
  "floors": null,
  "price_eur": null,
  "price_on_request": true,
  "site": null,
  "character": "Friesenhaus mit steilem Satteldach, prominentem Zwerchhaus über Eingang mit Rundbogen-Fenster, Klinkerfassade.",
  "agent_notes": "Zwerchhaus + Rundbogen-Giebelfenster im Vorbau. Giebelverglasung blockiert #109.",
  "tags": [
    "friesenhaus",
    "satteldach",
    "zwerchhaus",
    "klinker",
    "rundbogen"
  ],
  "images": [
    {
      "file": "nurda_friesenhaus-fs168_exterior1.original.avif",
      "category": "exterior",
      "medium": "render",
      "view": null,
      "caption": null
    },
    {
      "file": "nurda_friesenhaus-fs168_floorplan1.original.avif",
      "category": "floorplan",
      "medium": "drawing",
      "floor": null,
      "caption": null
    },
    {
      "file": "nurda_friesenhaus-fs168_floorplan2.original.avif",
      "category": "floorplan",
      "medium": "drawing",
      "floor": null,
      "caption": null
    }
  ],
  "bim_ai_blocking_issues": [
    "jhoetter/bim-ai#109"
  ]
}
