{
  "id": 61,
  "model": "Zweiständerhaus",
  "manufacturer": "Fuhrberger Fachwerkhaus",
  "source": "catalog",
  "source_url": "https://www.fertighaus.de/haeuser/fuhrberger-zweistaenderhaus/",
  "source_origin": null,
  "building_type": "EFH",
  "construction": "Holzbau",
  "roof_type": "Krüppelwalmdach",
  "style": "historisch",
  "energy_standard": null,
  "year_built": null,
  "has_basement": null,
  "levels": [
    "EG",
    "DG"
  ],
  "area_m2": null,
  "rooms": null,
  "floors": null,
  "price_eur": null,
  "price_on_request": true,
  "site": null,
  "character": "Aufwendiges Fachwerk-Zweiständerhaus mit Krüppelwalm, mehreren Zwerchgiebeln und Schleppgauben, Backsteinausfachung, Balkon mit Holzstützen.",
  "agent_notes": "Krüppelwalm (#105 closed) + sichtbares Fachwerk blockiert (#111). Zwerchgiebel via #65 (closed).",
  "tags": [
    "fachwerk",
    "krüppelwalm",
    "historisch",
    "zwerchgiebel"
  ],
  "images": [
    {
      "file": "fuhrberger_zweistaenderhaus_exterior1.original.avif",
      "category": "exterior",
      "medium": "photo",
      "view": null,
      "caption": null
    },
    {
      "file": "fuhrberger_zweistaenderhaus_exterior2.original.avif",
      "category": "exterior",
      "medium": "photo",
      "view": null,
      "caption": null
    },
    {
      "file": "fuhrberger_zweistaenderhaus_exterior3.original.avif",
      "category": "exterior",
      "medium": "photo",
      "view": null,
      "caption": null
    },
    {
      "file": "fuhrberger_zweistaenderhaus_exterior4.original.avif",
      "category": "exterior",
      "medium": "photo",
      "view": null,
      "caption": null
    }
  ],
  "bim_ai_blocking_issues": [
    "jhoetter/bim-ai#111"
  ],
  "data_quality": {
    "floorplan_grade": "none",
    "exterior_coverage": "all_facades",
    "elevation_set": "none",
    "section_drawing": "none",
    "roof_plan": "absent",
    "site_plan": "absent",
    "construction_specs": "summary"
  }
}
