{
  "id": 27,
  "model": "Bauhaus B180",
  "manufacturer": "Nurda",
  "source": "catalog",
  "source_url": "https://www.fertighaus.de/haeuser/nurda-bauhausb180/",
  "source_origin": null,
  "building_type": "EFH",
  "construction": "Fertighaus",
  "roof_type": null,
  "style": "bauhaus",
  "energy_standard": null,
  "year_built": null,
  "has_basement": null,
  "levels": null,
  "area_m2": 180,
  "rooms": null,
  "floors": null,
  "price_eur": null,
  "price_on_request": true,
  "site": null,
  "character": null,
  "agent_notes": null,
  "tags": [],
  "images": [
    {
      "file": "nurda_bauhaus-b180_exterior1.original.avif",
      "category": "exterior",
      "medium": "render",
      "view": null,
      "caption": null
    },
    {
      "file": "nurda_bauhaus-b180_floorplan1.original.avif",
      "category": "floorplan",
      "medium": "drawing",
      "floor": null,
      "caption": null
    },
    {
      "file": "nurda_bauhaus-b180_floorplan2.original.avif",
      "category": "floorplan",
      "medium": "drawing",
      "floor": null,
      "caption": null
    }
  ]
}
