{
  "id": 47,
  "model": "Selection E169 Entwurf 5",
  "manufacturer": "Schwabenhaus",
  "source": "catalog",
  "source_url": "https://www.fertighaus.de/haeuser/selection-e-169-entwurf-5/",
  "source_origin": null,
  "building_type": "EFH",
  "construction": "Fertighaus",
  "roof_type": null,
  "style": "modern",
  "energy_standard": null,
  "year_built": null,
  "has_basement": null,
  "levels": null,
  "area_m2": 169,
  "rooms": null,
  "floors": null,
  "price_eur": null,
  "price_on_request": true,
  "site": null,
  "character": null,
  "agent_notes": null,
  "tags": [],
  "images": [
    {
      "file": "schwabenhaus_selection169-e5_exterior1.original.avif",
      "category": "exterior",
      "medium": "render",
      "view": null,
      "caption": null
    },
    {
      "file": "schwabenhaus_selection169-e5_floorplan1.original.avif",
      "category": "floorplan",
      "medium": "drawing",
      "floor": null,
      "caption": null
    },
    {
      "file": "schwabenhaus_selection169-e5_floorplan2.original.avif",
      "category": "floorplan",
      "medium": "drawing",
      "floor": null,
      "caption": null
    }
  ]
}
