{
  "id": 8,
  "model": "Bunganlow 353",
  "manufacturer": "WEIOTT-Massiv-Haus",
  "source": "catalog",
  "source_url": "https://www.fertighaus.de/haeuser/weiott-bun353/",
  "source_origin": null,
  "building_type": "Bungalow",
  "construction": "Massivhaus",
  "roof_type": "Walmdach",
  "style": "klassisch",
  "energy_standard": "Effizienzhaus 55",
  "year_built": null,
  "has_basement": null,
  "levels": [
    "EG"
  ],
  "area_m2": 127,
  "rooms": 4,
  "floors": 1.0,
  "price_eur": null,
  "price_on_request": true,
  "site": null,
  "character": "Eingeschossiger Massiv-Bungalow mit Walmdach, gelber Putzfassade, zwei Dachflächenfenstern und integrierter Garage links. Klassischer Bungalow-Grundriss.",
  "agent_notes": "Walmdach + rechteckiges EG + angebaute Garage = bim-ai Standard (hip-Modus, edge_overhang_mm, RoofOpeningElem für Velux).",
  "tags": [],
  "bim_ai_blocking_issues": [],
  "images": [
    {
      "file": "weiott_bungalow353_exterior1.original.avif",
      "category": "exterior",
      "medium": "photo",
      "view": "front",
      "caption": "Straßenseite — Walmdach mit zwei Velux, Garage links"
    },
    {
      "file": "weiott_bungalow353_exterior2.original.avif",
      "category": "exterior",
      "medium": "photo",
      "view": "corner",
      "caption": "Eckansicht"
    },
    {
      "file": "weiott_bungalow353_floorplan1.original.avif",
      "category": "floorplan",
      "medium": "drawing",
      "floor": "EG",
      "caption": "Grundriss EG"
    }
  ],
  "data_quality": {
    "floorplan_grade": "dimensioned",
    "exterior_coverage": "multi_view",
    "elevation_set": "none",
    "section_drawing": "none",
    "roof_plan": "absent",
    "site_plan": "absent",
    "construction_specs": "summary"
  }
}
