{
  "id": 46,
  "model": "Solitaire E155 Entwurf 9",
  "manufacturer": "Schwabenhaus",
  "source": "catalog",
  "source_url": "https://www.fertighaus.de/haeuser/schwabenhaus-solitaeiree155e9/",
  "source_origin": null,
  "building_type": "EFH",
  "construction": "Fertighaus",
  "roof_type": "Flachdach",
  "style": "bauhaus",
  "energy_standard": null,
  "year_built": null,
  "has_basement": null,
  "levels": [
    "EG",
    "1. OG"
  ],
  "area_m2": 155,
  "rooms": null,
  "floors": null,
  "price_eur": null,
  "price_on_request": true,
  "site": null,
  "character": "Kubisches zweigeschossiges Bauhaus-EFH mit Flachdach, auskragendem OG-Volumen, zweifarbiger Putzfassade und Garagen-Anbau.",
  "agent_notes": "Bauhaus-Kubus + Wand-Auskragung + Garage. Voll modellierbar.",
  "tags": [
    "bauhaus",
    "flachdach",
    "auskragung",
    "garage"
  ],
  "images": [
    {
      "file": "schwabenhaus_solitaeree155-e9_exterior1.original.avif",
      "category": "exterior",
      "medium": "render",
      "view": null,
      "caption": null
    },
    {
      "file": "schwabenhaus_solitaeree155-e9_floorplan1.original.avif",
      "category": "floorplan",
      "medium": "drawing",
      "floor": null,
      "caption": null
    },
    {
      "file": "schwabenhaus_solitaeree155-e9_floorplan2.original.avif",
      "category": "floorplan",
      "medium": "drawing",
      "floor": null,
      "caption": null
    }
  ],
  "bim_ai_blocking_issues": [],
  "data_quality": {
    "floorplan_grade": "dimensioned",
    "exterior_coverage": "single_view",
    "elevation_set": "none",
    "section_drawing": "none",
    "roof_plan": "absent",
    "site_plan": "absent",
    "construction_specs": "summary"
  }
}
