{
  "id": 49,
  "model": "Solitaire E155 Entwurf 7",
  "manufacturer": "Schwabenhaus",
  "source": "catalog",
  "source_url": "https://www.fertighaus.de/haeuser/schwabenhaus-solitaeiree155e7/",
  "source_origin": null,
  "building_type": "EFH",
  "construction": "Fertighaus",
  "roof_type": "Walmdach",
  "style": "stadtvilla",
  "energy_standard": null,
  "year_built": null,
  "has_basement": null,
  "levels": [
    "EG",
    "1. OG"
  ],
  "area_m2": 155,
  "rooms": null,
  "floors": null,
  "price_eur": null,
  "price_on_request": true,
  "site": null,
  "character": "Stadtvilla mit klassischem Walmdach, Balkon-Auskragung im OG und überdachter Terrasse im EG, weiß verputzt.",
  "agent_notes": "Walmdach + Balkon-Auskragung + Terrassenüberdachung. Voll modellierbar.",
  "tags": [
    "stadtvilla",
    "walmdach",
    "balkon",
    "terrasse"
  ],
  "images": [
    {
      "file": "schwabenhaus_solitaeree155-e7_exterior1.original.avif",
      "category": "exterior",
      "medium": "render",
      "view": null,
      "caption": null
    },
    {
      "file": "schwabenhaus_solitaeree155-e7_floorplan1.original.avif",
      "category": "floorplan",
      "medium": "drawing",
      "floor": null,
      "caption": null
    },
    {
      "file": "schwabenhaus_solitaeree155-e7_floorplan2.original.avif",
      "category": "floorplan",
      "medium": "drawing",
      "floor": null,
      "caption": null
    }
  ],
  "bim_ai_blocking_issues": []
}
