{
  "id": 68,
  "model": "159 SB20",
  "manufacturer": "BioSolarHaus",
  "source": "catalog",
  "source_url": "https://www.fertighaus.de/haeuser/biosolarhaus-159sb20/",
  "source_origin": null,
  "building_type": "EFH",
  "construction": "Fertighaus",
  "roof_type": "Satteldach",
  "style": "modern",
  "energy_standard": "Effizienzhaus 40",
  "year_built": null,
  "has_basement": null,
  "levels": [
    "EG",
    "DG"
  ],
  "area_m2": 159,
  "rooms": null,
  "floors": null,
  "price_eur": null,
  "price_on_request": true,
  "site": null,
  "character": "Größeres BioSolar-Haus mit steilem Satteldach, geschwungenem Tonnendach-Anbau, vollflächiger Giebelverglasung und integriertem Wintergarten.",
  "agent_notes": "Tonnendach + Wintergarten blockiert (#114). Giebelverglasung blockiert (#109).",
  "tags": [
    "biosolar",
    "satteldach",
    "tonnendach",
    "wintergarten",
    "giebelverglasung"
  ],
  "images": [
    {
      "file": "159sb20_exterior1.original.avif",
      "category": "exterior",
      "medium": "render",
      "view": null,
      "caption": null
    },
    {
      "file": "159sb20_floorplan1.original.avif",
      "category": "floorplan",
      "medium": "drawing",
      "floor": null,
      "caption": null
    },
    {
      "file": "159sb20_floorplan2.original.avif",
      "category": "floorplan",
      "medium": "drawing",
      "floor": null,
      "caption": null
    }
  ],
  "bim_ai_blocking_issues": [
    "jhoetter/bim-ai#109",
    "jhoetter/bim-ai#114"
  ],
  "data_quality": {
    "floorplan_grade": "dimensioned",
    "exterior_coverage": "single_view",
    "elevation_set": "none",
    "section_drawing": "none",
    "roof_plan": "absent",
    "site_plan": "absent",
    "construction_specs": "summary"
  }
}
